<?xml version="1.0" encoding="UTF-8" ?>
<meiQiReferrer xmlns:xsi="http://www.w3.org/2001/XMLSchema-instance" xsi:noNamespaceSchemaLocation="payWay.xsd">
	<sections>
		<sectionName>PayWaySection</sectionName>
		<sectionItems>
			<modelName>PayWayOrderInfoCellData</modelName>
			<viewName>PayWayOrderInfoCell</viewName>
			<data>
				<lblOrderNumber>${OrderItem.orderSn}</lblOrderNumber>
				<lblOrderPrice>￥${OrderItem.amount}</lblOrderPrice>
			</data>
		</sectionItems>
		<sectionItems/>
	</sections>
	<sections>
		<sectionName>PayWaySection</sectionName>
		<sectionItems>
			<viewName>PayWayCell</viewName>
			<data>
				<lblTitle>支付宝</lblTitle>
				<lblDescribe>需安装支付宝客户端</lblDescribe>
				<imgLogo>http://image.lejj.com/images/s-20150616/64//812845c534047716b679dfe6cfc76854.png</imgLogo>
			</data>
			<actions>
				<actionName>alipayCommand</actionName>
		        <sender></sender>
				<title></title>
				<actionValue>
			${OrderItem.carts[0].goods[0].name} ${OrderItem.goodsAmount(1,,等多件)}|${OrderItem.orderSn}|${OrderItem.orderId}|${OrderItem.alipayNotifyURL}|${OrderItem.amount}
				</actionValue>
			</actions>
			<actions/>
		</sectionItems>
		<sectionItems/>
	</sections>
</meiQiReferrer>